Month,Dates,Item,Genre ,Link,Description
February,13.02-14.03,CTM Cyberia - Virtual multiplayer festival environment,online exhibition,https://www.ctm-festival.de/festival-2021/programme/exhibition/cyberia,CTM Cyberia throws festival goers into a landscape of Transformation. Explore a range of digital artworks hidden throughout a disorienting environment of mercurial visuals and erratic sounds.
February,14.02.,Revenge on patriarchy! Against all forms of sexism – in the streets and at home! #MyBodyIsNotYourPorn,demo,https://racheampatriarchatberlin.noblogs.org/,
February,14.02.,English Online-Tour: Valentine's Day in Vienna,online tour,https://fb.me/e/27K3BBxoc,
February,15.02.,Unverzichtbar Feministisch - 30 Jahre Ostberliner Frauenzentren,online lecture ,https://calendar.boell.de/de/event/unverzichtbar-feministisch-30-jahre-ostberliner-frauenzentren,"""30 Jahre Ostberliner Frauenzentren"" geben den Anlass, die Geschichte und die Zukunft dieser Orte und ihr frauenpolitisches bzw. feministisches Wirken in den Fokus zu rücken."
February,16.02.,Revolte in Chile - Lesung mit Sophia Boddenberg,reading ,"Um Anmeldung wird gebeten, per Mail an: ute.loehning@npla.de","In der Online-Verstanstaltung wird Sophia Boddenberg kurze Passagen ihres Buches vorlesen. Gemeinsam mit ihr wollen wir bei dieser Gelegenheit über die Aufbruchstimmung, Hoffnung und die Diversität der Protestbewegung sprechen, in der sich Alte und Junge, Feministinnen und Indigene zusammenfinden."
February,17.02.,Queere Ängste,workshop,http://queertopia.blogsport.de/termine-dates/#16022021,
February,17.02.,WILDWUCHS - Autorinnenkurzfestival in Kooperation mit der UdK Berlin,theatre ,https://td.berlin/streaming,Thre short plays by female authors and directors
February,18.02,"Körperpolitiken und Aufklärungsmodi in deutschsprachigen feministischen Comics der Gegenwart, Dr. Nina Schmidt (Freie Universität Berlin)",lecture,https://www.fu-berlin.de/campusleben/kalender/2021/02/20210218-koerperpolitiken-und-aufklaerungsmodi.html,"Vortrag im Rahmen der Ringvorlesung ""Comic – Kunst – Körper. Konstruktion und Subversion von Körperbildern im Comic"""
February,18.02,WILDWUCHS - Autorinnenkurzfestival in Kooperation mit der UdK Berlin,theatre ,https://td.berlin/streaming,Thre short plays by female authors and directors
February,18.02,Krawalle und Liebe,"reading, pop, conversation",https://lfbrecht.de/,"Sexism and sexualised violence is part of the daily life of women, lesbians, inter, non-binary, trans, queer and asexuel people, of FLINTA*. We share the experiance of being objectified and sexualised constantly. This sucks – we have had enough!"
February,19.02,Valeria Bruschi: Einführung zu feministischem Marxismus – Positionen zu geschlechtlicher Arbeitsteilung und Reproduktionsarbeit,"reading, pop, conversation",https://www.facebook.com/events/240361094354136,"Jenseits von Forderungen nach Wahlrecht oder Repräsentation gibt es seit der Entstehung der bürgerlichen Gesellschaft eine Tradition von feministischem Denken, das den Kapitalismus radikal kritisiert. "
February,19.02,43% Zartbitter. Rassismus & Liebe,"reading, lecture",https://calendar.boell.de/de/event/43-zartbitter-rassismus-liebe,"Wunderbare Word Art-Künstler*innen erinnern sich, denken laut, sind ungehalten und wütend: Rassismus und Diskriminierung wirken selbst in persönlichsten Lebensbereichen,- dies ist eine bittere Erfahrung von Schwarzen Menschen und von People of Color (PoC)."
February,21.02.,Lùisa @ Press Play - Livestream Konzerte,Concert ,https://www.eventbrite.de/e/luisa-press-play-livestream-konzerte-tickets-134445509137?aff=,
February,24.02.,"Sharon Dodua Otoo ""Adas Raum""",reading,https://lfbrecht.de/event/sharon-dodua-otoo-adas-raum/,
February,25.02,Frauen an die Bücher!,reading group,https://www.meetup.com/fr-FR/Feministischer-Buchclub/events/zdpbcsyccdbhc/,"Zum 25.02. lesen wir ""Schwarzer Feminismus - Grundlagentexte"" Natasha A. Kelly."
February,25.02,Environment as Evidence,online class,http://schoolofma.org/environment-as-evidence.html,"How can we use spatial investigation of nature as a political sensor for expanding the practices of open-source activism far and wide? School of Machines, Making & Make-Believe presents 5-wk online class dedicated to data&spatial storytelling for investigative journalism. "
February,26.02,Wissenschaftliches Schreiben zu lesbischen und queer-fem. Themen,academic writing,http://www.spinnboden.de/kultur/workshops.html,
February,26.02.-27.02.,Digital: Mourning becomes Electra von Eugene O'Neill,theatre ,https://dringeblieben.de/videos/mourning-becomes-electra-von-eugene-oneill,"A family hell on permanent loop. Even centuries after Aeschylus' Oresteia and countless literary adaptations, Electra still has to mourn. Electra is still at the mercy of her fate."
February,27.02.,Positive Experiences with doing Politics & Reassure,workshop,http://queertopia.blogsport.de/termine-dates/#16022021,
February,28.02.,Mx. Lockdown // A One-Time Digital Drag Pageant,drag pageant,twitch.tv/pansypresents,
March,12.03.,"Interaktive Vorstelllung zu ""Unsichtbare Frauen- Wie eine von Daten beherrschte Welt die Hälfte der Bevölkerung ignoriert""",reading and lecture,https://gruene-ts.de/ts_termin/unsichtbare-frauen-wie-eine-von-daten-beherrschte-welt-die-haelfte-der-bevoelkerung-ignoriert/,"„Dieses Buch ist ein Wendepunkt“, schreibt die Süddeutsche Zeitung begeistert. Die grünen Frauen laden Sie zur interaktiven Vorstellung des viel diskutierten Buches von Caroline Criado-Perez – natürlich mit begleitender Diskussion - im Frauenmärz ein."
March,13.02-14.03,CTM Cyberia - Virtual multiplayer festival environment,online exhibition,https://www.ctm-festival.de/festival-2021/programme/exhibition/cyberia,CTM Cyberia throws festival goers into a landscape of Transformation. Explore a range of digital artworks hidden throughout a disorienting environment of mercurial visuals and erratic sounds.
March,01.03.,Online-Workshop: Intersektionale Diskriminierungskritik,online lecture,www.shmh.de/diskriminierungskritik01032021,Einstieg in die intersektionale Diskriminierungskritik mit Josephine Apraku und Dr. Jule Bönkost.
March,02.03.,"Gender, sexual and amorous Diversity",workshop,http://queertopia.blogsport.de/termine-dates/#16022021,
March,03.03.,Onlinevortrag (Englisch): Sexualisierte Gewalt in Israel – der Frauennotruf im Austausch,presentation ,https://www.frauennotruf-mainz.de/pressemitteilung-veranstaltung/onlinevortrag-englisch-sexualisierte-gewalt-israel-der-frauennotruf,Wie verhält und entwickelt sich das gesellschaftspolitische Klima in Israel zum Thema sexualisierte Gewalt? 
March,04.03.,In der Zukunft treffen wir uns – sorgearbeit. wohnen. queerfeministisch,workshop ,https://konzeptwerk-neue-oekonomie.org/termin/in-der-zukunft-treffen-wir-uns-sorgearbeit-wohnen-queerfeministisch/,"Gemeinsam mit unseren drei Gästen Lina Hurlein, Francis Seeck und Mono Welk werden wir nach einer queerfeministischen Vision suchen. "
March,04.03.,Demokratie braucht Feminismus! – Antifeminismus online entgegentreten,workshop,https://calendar.boell.de/de/event/demokratie-braucht-feminismus-antifeminismus-online-entgegentreten-3,Das zweistündige Online-Seminar bietet dabei einen Einstieg in die Thematik. Was ist Antifeminismus überhaupt und wie können wir ihn online erkennen? 
March,06.03.,Transfeindlichkeit - Aspekte geschlechtlicher Marginalisierung,reading and lecture,http://www.spinnboden.de/kultur/vortraege.html,"Es gibt verschiedene Formen von Diskriminierung: etwa Rassismus, Sexismus, Klassismus und Ableismus. Intersektionalität meint ihr Zusammenwirken."
March,17.03.,Feminstische Sex Wars und Femme/Butch in der Westberliner Lesbenzeitschrift UKZ,lecture,http://www.spinnboden.de/kultur/vortraege.html,"Im Vortrag werden Diskussionen über lesbisch_queere Sexualität innerhalb der UKZ der 1980er und 90er Jahre vorgestellt. Es wird der Frage nachgegangen, inwiefern Sexualitätsdiskurse als Aushandlungsorte lesbisch_queerer Identitäts- und Geschlechtskonzeptionen fungierten. "
March,17.03.,Masculinities: Liberation through Photography,exhibition,https://www.berlinerfestspiele.de/de/gropiusbau/programm/2020/masculinities/masculinities-digital.html,"Group exhibition at the Gropius Bau titled “Masculinities: Liberation through Photography” explores the ways in which masculinity is experienced, performed and socially constructed from the 1960s to the present day. "
March,22.03.,Onlineseminar | Veranstaltungen intersektional gestalten,online class,https://www.vnb-ev.de/index.php?module=014000&dat=14775,"Die Veranstaltung lenkt den Blick auf die sogenannten „blinden Flecken“, die wir alle besitzen, wenn es darum geht, Veranstaltungen inklusiv und diskriminierungssensibel zu gestalten."
March,22.03.,"Gender, sexual and amorous Diversity",workshop,http://queertopia.blogsport.de/termine-dates/#16022021,
March,23.03.,Online-Workshop: Intersektionale Diskriminierungskritik,online lecture,www.shmh.de/diskriminierungskritik23032021,Einstieg in die intersektionale Diskriminierungskritik mit Josephine Apraku und Dr. Jule Bönkost.
March,27.03.,Intersectionality,workshop,http://queertopia.blogsport.de/termine-dates/#16022021,
April,2021-04-02,female:pressure Circle @ HÖR,music,https://www.youtube.com/channel/UCmfF7JZv26UUKyRedViGIlw,
April,06.04,Pornfilmfestival: Female Porn Shorts,cinema,https://www.moviemento.de/,
April,22.04.,Frauen an die Bücher!,reading group,https://www.meetup.com/fr-FR/Feministischer-Buchclub/events/zdpbcsyccgbdc/,"Zum 22.04. lesen wir ""Queenie"" von Candice Party-Williams zu Ende."
April,22.04.,Demokratie braucht Feminismus! – Antifeminismus online entgegentreten,workshop,https://calendar.boell.de/de/node/143555,Das zweistündige Online-Seminar bietet dabei einen Einstieg in die Thematik. Was ist Antifeminismus überhaupt und wie können wir ihn online erkennen? 
May,,,,,
June,15.06.,Demokratie braucht Feminismus! – Antifeminismus online entgegentreten,workshop ,https://calendar.boell.de/de/node/143557,"Das zweistündige Online-Seminar bietet dabei einen Einstieg in die Thematik. Was ist Antifeminismus überhaupt und wie können wir ihn online erkennen? Welche Strategien gibt es, um auf antifeministische Aussagen zu reagieren?"